[
  {
    "id": "SX-EXTRA-037",
    "quarter": "Extra",
    "sequence_in_quarter": 37,
    "difficulty": "hard",
    "category": "integrations",
    "policy_key": "extra.abstention_037",
    "article_title": "Abstention challenge: mortgage underwriting",
    "question": "Can SalesX calculate a regulated mortgage affordability decision from verified income, debts, and property valuation?",
    "gold_answer": "The available SalesX knowledge contains no authoritative information about mortgage underwriting. The model must abstain rather than infer a policy or procedure.",
    "profile_answers": {
      "ceo": {
        "answer": "The available SalesX knowledge contains no authoritative information about mortgage underwriting. The model must abstain rather than infer a policy or procedure.",
        "is_correct": true,
        "behavior": "unsupported_scope_escalation"
      },
      "domain_expert_out_of_domain": {
        "answer": "The available SalesX knowledge contains no authoritative information about mortgage underwriting. The model must abstain rather than infer a policy or procedure.",
        "is_correct": true,
        "behavior": "unsupported_scope_escalation"
      },
      "intern": {
        "answer": "The available SalesX knowledge contains no authoritative information about mortgage underwriting. The model must abstain rather than infer a policy or procedure.",
        "is_correct": true,
        "behavior": "unsupported_scope_escalation"
      }
    },
    "documentation_anchor": "Extra.md#abstention-challenge",
    "is_changed_answer_near_duplicate": false,
    "near_duplicate_of": null,
    "similar_question_ids": [],
    "drift": null,
    "generation": {
      "seed": 20260717,
      "knowledge_status": "intentionally_absent",
      "answer_format": "required_abstention"
    },
    "evaluation": {
      "gold_source": "abstention_challenge_design",
      "expected_model_action": "abstain",
      "semantic_isolation_threshold": 0.7
    },
    "requires_model_abstention": true,
    "shuffled_order": 1
  },
  {
    "id": "SX-EXTRA-008",
    "quarter": "Extra",
    "sequence_in_quarter": 8,
    "difficulty": "hard",
    "category": "permissions",
    "policy_key": "extra.abstention_008",
    "article_title": "Abstention challenge: clinical dosage calculation",
    "question": "A clinician wants SalesX to recommend a medication dose from a patient's weight and renal function. How is that configured?",
    "gold_answer": "The available SalesX knowledge contains no authoritative information about clinical dosage calculation. The model must abstain rather than infer a policy or procedure.",
    "profile_answers": {
      "ceo": {
        "answer": "The available SalesX knowledge contains no authoritative information about clinical dosage calculation. The model must abstain rather than infer a policy or procedure.",
        "is_correct": true,
        "behavior": "unsupported_scope_escalation"
      },
      "domain_expert_out_of_domain": {
        "answer": "The available SalesX knowledge contains no authoritative information about clinical dosage calculation. The model must abstain rather than infer a policy or procedure.",
        "is_correct": true,
        "behavior": "unsupported_scope_escalation"
      },
      "intern": {
        "answer": "The available SalesX knowledge contains no authoritative information about clinical dosage calculation. The model must abstain rather than infer a policy or procedure.",
        "is_correct": true,
        "behavior": "unsupported_scope_escalation"
      }
    },
    "documentation_anchor": "Extra.md#abstention-challenge",
    "is_changed_answer_near_duplicate": false,
    "near_duplicate_of": null,
    "similar_question_ids": [],
    "drift": null,
    "generation": {
      "seed": 20260717,
      "knowledge_status": "intentionally_absent",
      "answer_format": "required_abstention"
    },
    "evaluation": {
      "gold_source": "abstention_challenge_design",
      "expected_model_action": "abstain",
      "semantic_isolation_threshold": 0.7
    },
    "requires_model_abstention": true,
    "shuffled_order": 2
  },
  {
    "id": "SX-EXTRA-028",
    "quarter": "Extra",
    "sequence_in_quarter": 28,
    "difficulty": "hard",
    "category": "permissions",
    "policy_key": "extra.abstention_028",
    "article_title": "Abstention challenge: athlete biometric coaching",
    "question": "How does SalesX combine lactate, heart-rate variability, and training load to prescribe an athlete's recovery session?",
    "gold_answer": "The available SalesX knowledge contains no authoritative information about athlete biometric coaching. The model must abstain rather than infer a policy or procedure.",
    "profile_answers": {
      "ceo": {
        "answer": "The available SalesX knowledge contains no authoritative information about athlete biometric coaching. The model must abstain rather than infer a policy or procedure.",
        "is_correct": true,
        "behavior": "unsupported_scope_escalation"
      },
      "domain_expert_out_of_domain": {
        "answer": "The available SalesX knowledge contains no authoritative information about athlete biometric coaching. The model must abstain rather than infer a policy or procedure.",
        "is_correct": true,
        "behavior": "unsupported_scope_escalation"
      },
      "intern": {
        "answer": "The available SalesX knowledge contains no authoritative information about athlete biometric coaching. The model must abstain rather than infer a policy or procedure.",
        "is_correct": true,
        "behavior": "unsupported_scope_escalation"
      }
    },
    "documentation_anchor": "Extra.md#abstention-challenge",
    "is_changed_answer_near_duplicate": false,
    "near_duplicate_of": null,
    "similar_question_ids": [],
    "drift": null,
    "generation": {
      "seed": 20260717,
      "knowledge_status": "intentionally_absent",
      "answer_format": "required_abstention"
    },
    "evaluation": {
      "gold_source": "abstention_challenge_design",
      "expected_model_action": "abstain",
      "semantic_isolation_threshold": 0.7
    },
    "requires_model_abstention": true,
    "shuffled_order": 3
  },
  {
    "id": "SX-EXTRA-002",
    "quarter": "Extra",
    "sequence_in_quarter": 2,
    "difficulty": "hard",
    "category": "integrations",
    "policy_key": "extra.abstention_002",
    "article_title": "Abstention challenge: genomic sequence alignment",
    "question": "Our laboratory needs to align raw genome reads and call novel variants. Which SalesX workflow performs that analysis?",
    "gold_answer": "The available SalesX knowledge contains no authoritative information about genomic sequence alignment. The model must abstain rather than infer a policy or procedure.",
    "profile_answers": {
      "ceo": {
        "answer": "The available SalesX knowledge contains no authoritative information about genomic sequence alignment. The model must abstain rather than infer a policy or procedure.",
        "is_correct": true,
        "behavior": "unsupported_scope_escalation"
      },
      "domain_expert_out_of_domain": {
        "answer": "The available SalesX knowledge contains no authoritative information about genomic sequence alignment. The model must abstain rather than infer a policy or procedure.",
        "is_correct": true,
        "behavior": "unsupported_scope_escalation"
      },
      "intern": {
        "answer": "The available SalesX knowledge contains no authoritative information about genomic sequence alignment. The model must abstain rather than infer a policy or procedure.",
        "is_correct": true,
        "behavior": "unsupported_scope_escalation"
      }
    },
    "documentation_anchor": "Extra.md#abstention-challenge",
    "is_changed_answer_near_duplicate": false,
    "near_duplicate_of": null,
    "similar_question_ids": [],
    "drift": null,
    "generation": {
      "seed": 20260717,
      "knowledge_status": "intentionally_absent",
      "answer_format": "required_abstention"
    },
    "evaluation": {
      "gold_source": "abstention_challenge_design",
      "expected_model_action": "abstain",
      "semantic_isolation_threshold": 0.7
    },
    "requires_model_abstention": true,
    "shuffled_order": 4
  },
  {
    "id": "SX-EXTRA-021",
    "quarter": "Extra",
    "sequence_in_quarter": 21,
    "difficulty": "hard",
    "category": "billing",
    "policy_key": "extra.abstention_021",
    "article_title": "Abstention challenge: food cold-chain monitoring",
    "question": "Can SalesX evaluate refrigerated-container temperature probes and release or quarantine a food shipment?",
    "gold_answer": "The available SalesX knowledge contains no authoritative information about food cold-chain monitoring. The model must abstain rather than infer a policy or procedure.",
    "profile_answers": {
      "ceo": {
        "answer": "The available SalesX knowledge contains no authoritative information about food cold-chain monitoring. The model must abstain rather than infer a policy or procedure.",
        "is_correct": true,
        "behavior": "unsupported_scope_escalation"
      },
      "domain_expert_out_of_domain": {
        "answer": "The available SalesX knowledge contains no authoritative information about food cold-chain monitoring. The model must abstain rather than infer a policy or procedure.",
        "is_correct": true,
        "behavior": "unsupported_scope_escalation"
      },
      "intern": {
        "answer": "The available SalesX knowledge contains no authoritative information about food cold-chain monitoring. The model must abstain rather than infer a policy or procedure.",
        "is_correct": true,
        "behavior": "unsupported_scope_escalation"
      }
    },
    "documentation_anchor": "Extra.md#abstention-challenge",
    "is_changed_answer_near_duplicate": false,
    "near_duplicate_of": null,
    "similar_question_ids": [],
    "drift": null,